headline,date,doc_type,material_type,section,keywords,word_count
Lawmakers Press Biden to Track U.S. Aid Tied to Civilian Harm in Yemen,2022-09-07,article,News,U.S.,"['Civilian Casualties', 'War and Armed Conflicts', 'Arms Trade', 'Foreign Aid', 'Drones (Pilotless Planes)', 'United States Defense and Military Forces', 'United States International Relations', 'United States Politics and Government']",921
One Solution to the Digital Divide: Teens,2022-09-07,article,News,Technology,"['internal-sub-only-nl', 'Computers and the Internet', 'Rural Areas', 'E-Learning']",1115
Venice: Could ‘Banshees’ Be Colin Farrell’s Oscar Breakthrough?,2022-09-07,article,News,Movies,"['Movies', 'Venice International Film Festival', 'Actors and Actresses']",579
"Apple Extends Reach With $800 Watch, as New iPhone Inches Along",2022-09-07,article,News,Technology,"['Wearable Computing', 'iPhone', 'Watches and Clocks', 'Computers and the Internet']",976
The Mars Volta Returns With a Swerve: Its Own Version of Pop,2022-09-07,article,News,Arts,"['Pop and Rock Music', 'Content Type: Personal Profile']",1297
Longing for Things Just Out of Reach,2022-09-07,article,Review,Books,['Books and Literature'],1170
Official Obama Portraits Are Finally Unveiled at the White House,2022-09-07,article,News,Arts,"['Art', 'United States Politics and Government', 'White House Building (Washington, DC)', 'Presidents and Presidency (US)', 'First Ladies (US)']",1249
Painting Michelle Obama Took 9 Months. Keeping It Secret Took 6 Years.,2022-09-07,article,News,Arts,"['Art', 'First Ladies (US)', 'United States Politics and Government', 'Content Type: Personal Profile']",1082
"The Best Movies and TV Shows Coming to HBO, Hulu, Apple TV+ and More in September",2022-09-07,article,News,Arts,['Television'],1504
Scenes From California’s Historic Heat Wave,2022-09-07,article,News,U.S.,"['Heat and Heat Waves', 'Power Failures and Blackouts', 'Weather']",331
An American Leads the Odesa Philharmonic to Berlin,2022-09-07,article,News,Arts,"['Classical Music', 'Russian Invasion of Ukraine (2022)', 'Content Type: Personal Profile']",1414
Academy Museum’s Show on Black Cinema Raises Questions About Who It’s For,2022-09-07,article,News,Movies,"['Museums', 'Black People', 'Blacks', 'Movies']",1291
Rushdie Case Prosecutors Ask for Delay to Pore Over Mountain of Evidence,2022-09-07,article,News,New York,"['Murders, Attempted Murders and Homicides', 'Freedom of Speech and Expression', 'Muslims and Islam']",518
This Is the Kind of Storytelling That Economics Needs,2022-09-07,article,Op-Ed,Opinion,"['internal-sub-only-nl', 'Economics (Theory and Philosophy)', 'Books and Literature', 'Writing and Writers', 'Science Fiction']",1209
"The Real Lives of Early 20th-Century Celebrities, as Depicted in ‘Ragtime’",2022-09-07,article,News,T Magazine,['Books and Literature'],2380
A Long-Shot Push to Bar Trump in 2024 as an ‘Insurrectionist’,2022-09-07,article,News,U.S.,"['Storming of the US Capitol (Jan, 2021)', 'United States Politics and Government', 'Fourteenth Amendment (US Constitution)', 'Law and Legislation', 'Project Democracy']",1621
A Chimpanzee Escaped From a Ukrainian Zoo. She Returned on a Bicycle.,2022-09-07,article,News,World,"['Zoos', 'Russian Invasion of Ukraine (2022)', 'Monkeys and Apes']",416
The Baltic States agree to bar land crossings by Russian tourists.,2022-09-07,article,News,World,[],583
Bidens Host Obamas for Official White House Portraits Unveiling,2022-09-07,multimedia,Video,Arts,"['Art', 'White House Building (Washington, DC)', 'United States Politics and Government', 'First Ladies (US)', 'Presidents and Presidency (US)']",0
Sex-Cult Leader’s ‘Trusted Lieutenant’ Pleads Guilty to Conspiracy,2022-09-07,article,News,New York,['Sex Crimes'],931
Truss Forms a Cabinet Diverse in Background but Not in Ideology,2022-09-07,article,News,World,"['Elections', 'Politics and Government', 'Colleges and Universities']",1186
Frances Tiafoe Rolls On to the Semis,2022-09-07,article,News,Sports,"['Tennis', 'United States Open (Tennis)']",1148
"In Horror Movies This Fall, Three Faces to Watch",2022-09-07,article,News,Movies,"['Movies', 'Television', 'Actors and Actresses']",1189
"Biden Tries to Condemn Trumpism, Without Writing Off the G.O.P.",2022-09-07,article,News,U.S.,"['United States Politics and Government', 'Right-Wing Extremism and Alt-Right', 'Midterm Elections (2022)']",1113
Boston Globe Editor to Step Down,2022-09-07,article,News,Business Day,"['Appointments and Executive Changes', 'News and News Media']",364
Your Thursday Briefing: Vladimir Putin and Xi Jinping Likely to Meet,2022-09-07,article,briefing,Briefing,"['Elections', 'War and Armed Conflicts', 'Books and Literature', 'Politics and Government', 'United States International Relations', 'Coronavirus (2019-nCoV)', 'Embargoes and Sanctions', 'Russian Invasion of Ukraine (2022)']",1230
Lawyers for Uber’s Ex-Security Chief Say Company Scapegoated Him,2022-09-07,article,News,Technology,"['Computer Security', 'Cyberattacks and Hackers']",774
The Office and Covid,2022-09-07,article,News,Briefing,"['Coronavirus (2019-nCoV)', 'Coronavirus Return to Office']",1694
"Fearing E. Coli, West Baltimore Boils Water in Latest Crisis",2022-09-07,article,News,U.S.,"['Water Pollution', 'E Coli (Bacteria)', 'Infrastructure (Public Works)']",813
"From Russia, With Bluster and Fear",2022-09-07,article,News,Briefing,"['Russian Invasion of Ukraine (2022)', 'Censorship']",1445
Food Insecurity for Families With Children Reached Two-Decade Low in 2021,2022-09-07,article,News,U.S.,"['Food', 'Food Insecurity', 'Coronavirus (2019-nCoV)', 'Tax Credits, Deductions and Exemptions']",570
"Don Gehrmann, Whose Victory in a Mile Took 314 Days, Dies at 94",2022-09-07,article,Obituary (Obit),Sports,"['Deaths (Obituaries)', 'Track and Field', 'Millrose Games']",846
Your Wednesday Evening Briefing,2022-09-07,article,News,Briefing,"['Fashion and Apparel', 'Midterm Elections (2022)', 'Watches and Clocks', 'Forests and Forestry', 'War and Armed Conflicts']",1286
"Anne Garrels, Fearless NPR Correspondent, Dies at 71",2022-09-07,article,Obituary (Obit),Business Day,"['Deaths (Obituaries)', 'News and News Media', 'Radio', 'Iraq War (2003-11)', 'Afghanistan War (2001- )']",1417
Can America’s Schoolchildren Recover From the Pandemic?,2022-09-07,article,Op-Ed,Opinion,"['Education (K-12)', 'Coronavirus Reopenings', 'Children and Childhood', 'Tests and Examinations']",1623
Egypt Files Criminal Charges Against Four Journalists Over One Article,2022-09-07,article,News,World,"['News and News Media', 'Freedom of the Press', 'Censorship', 'Politics and Government']",553
"On Brazil’s Bicentennial, Softer Rhetoric From a President",2022-09-07,article,News,World,"['Elections', 'Politics and Government', 'Project Democracy']",1191
Raises and Safety Protections in City Ballet Dancers’ New Contract,2022-09-07,article,News,Arts,"['Dancing', 'Organized Labor', 'Coronavirus (2019-nCoV)']",513
Trump Aide Is Subpoenaed for Jan. 6 Grand Jury,2022-09-07,article,News,U.S.,"['Storming of the US Capitol (Jan, 2021)', 'Presidential Election of 2020', 'Voter Fraud (Election Fraud)', 'Subpoenas', 'United States Politics and Government']",622
California Leaders Credit Cellphone Alert for Sudden Conservation,2022-09-07,article,News,U.S.,"['Electric Light and Power', 'Heat and Heat Waves', 'Security and Warning Systems', 'Cellular Telephones', 'Power Failures and Blackouts']",971
4 Types of Voters We’re Watching in the Midterms,2022-09-07,article,News,U.S.,"['United States Politics and Government', 'internal-sub-only-nl', 'Midterm Elections (2022)', 'Polls and Public Opinion']",1321
"Dismissing Losses in Ukraine, Putin Says Russia Is Gaining From War",2022-09-07,article,News,World,"['Russian Invasion of Ukraine (2022)', 'Speeches and Statements', 'Embargoes and Sanctions', 'Economic Conditions and Trends', 'Polls and Public Opinion', 'Politics and Government']",1107
"In Bannon Case, Manhattan D.A. Takes On Another Pardoned Trump Ally",2022-09-07,article,News,New York,"['United States Politics and Government', 'Amnesties, Commutations and Pardons', 'Frauds and Swindling', 'Border Barriers', 'Embezzlement']",1039
Who Will Control the Senate? The Answer Could Be in an Email.,2022-09-07,article,Op-Ed,Opinion,"['Elections, Senate', 'Campaign Finance', 'Midterm Elections (2022)']",924
Pakistan’s Vulnerability to Disaster Was Through the Roof. Then Came the Floods.,2022-09-07,article,Op-Ed,Opinion,"['internal-sub-only-nl', 'Global Warming', 'Floods', 'Compensation for Damages (Law)', 'Weather', 'Heat and Heat Waves', 'Third World and Developing Countries', 'Agriculture and Farming', 'Monsoons']",2185
"Politician Arrested in Las Vegas Reporter’s Stabbing Death, Prosecutor Says",2022-09-07,article,News,U.S.,"['Murders, Attempted Murders and Homicides', 'News and News Media', 'Politics and Government']",1006
Texas Judge’s Ruling Puts Free Preventive Care in Jeopardy,2022-09-07,article,News,U.S.,"['Decisions and Verdicts', 'Patient Protection and Affordable Care Act (2010)', 'Health Insurance and Managed Care', 'Preventive Medicine', 'Freedom of Religion', 'Constitution (US)', 'Acquired Immune Deficiency Syndrome']",949
"Review: In ‘Kate,’ Tracing the Tears of a Clown",2022-09-08,article,Review,Theater,"['Theater', 'Crying', 'Comedy and Humor', 'Actors and Actresses']",844
Bird Flu Found in Dolphin in Florida and Porpoise in Sweden,2022-09-08,article,News,Health,"['Dolphins and Porpoises', 'Avian Influenza', 'Birds', 'your-feed-science', 'your-feed-animals', 'your-feed-health']",863
"In a 1988 Murder, DNA Is Used to Identify Both the Victim and Her Killer",2022-09-08,article,News,U.S.,"['Murders, Attempted Murders and Homicides', 'DNA (Deoxyribonucleic Acid)', 'Forensic Science', 'Genealogy']",1109
Justice Dept. Faces Tough Calls in Weighing Response to Trump Ruling,2022-09-08,article,News,U.S.,"['Classified Information and State Secrets', 'Executive Privilege, Doctrine of', 'United States Politics and Government', 'Decisions and Verdicts']",1186
Love of Texting,2022-09-08,article,News,Crosswords & Games,['Crossword Puzzles'],672
Shooting Spree Leaves 4 Dead in Memphis and Paralyzes City,2022-09-08,article,News,U.S.,"['Memphis, Tenn, Shootings (Sept 7, 2022)']",815
N.F.L. Week 1 Predictions: Our Picks Against the Spread,2022-09-08,article,News,Sports,[],2038
Ukrainians Find Russian Coming-Out Party Hard to Celebrate at U.S. Open,2022-09-08,article,News,Sports,"['Tennis', 'War and Armed Conflicts', 'Russian Invasion of Ukraine (2022)', 'United States Open (Tennis)']",1351
"His Bees Fly to the Front Line. Soon, It May Come to Him.",2022-09-08,article,News,World,"['War and Armed Conflicts', 'Flowers and Plants', 'Seasons and Months', 'Bees', 'Civilian Casualties', 'Russian Invasion of Ukraine (2022)']",1233
California Muddles Through Another Hot Day,2022-09-08,article,News,U.S.,['Heat and Heat Waves'],361
Many Subway Riders Gave Up on the Mask Mandate Before Hochul Did,2022-09-08,article,briefing,New York,"['internal-storyline-no', 'Masks', 'Amnesties, Commutations and Pardons', 'Frauds and Swindling', 'Transit Systems']",1495
Second Suspect in Canada Killings Dies After Capture,2022-09-08,multimedia,Video,World,"['Saskatchewan, Canada, Stabbings (2022)', 'Police', 'Murders, Attempted Murders and Homicides']",0
Your Thursday Briefing,2022-09-08,article,briefing,Briefing,[],1367
Jimmy Kimmel Declares Trump ‘the Worst Ex Ever’,2022-09-08,article,News,Arts,"['Television', 'internal-sub-only']",495
Word of the Day: peruse,2022-09-08,article,News,The Learning Network,[],286
Orange Ball,2022-09-08,article,News,The Learning Network,[],97
Spelling Bee Forum,2022-09-08,article,News,Crosswords & Games,[],165
What’s Going on With the Magical Mystery Shampoo?,2022-09-08,article,News,Style,"['Content Type: Personal Profile', 'Hair', 'Beauty Salons', 'Shampoos and Hair Products']",2267
"Why a Narrow, Hard-Right G.O.P. House Majority Could Spell Chaos",2022-09-08,article,News,U.S.,"['Midterm Elections (2022)', 'Elections, House of Representatives', 'Right-Wing Extremism and Alt-Right', 'United States Politics and Government', 'Conservatism (US Politics)']",1569
The Legend on Lexington,2022-09-08,article,News,Style,"['Shopping and Retail', 'Fashion and Apparel']",2694
"Solomon Islands’ Leader, a Friend of China, Gets an Election Delayed",2022-09-08,article,News,World,"['Politics and Government', 'Elections', 'International Relations']",1194
Fire at a Karaoke Bar in Vietnam Kills 32,2022-09-08,article,News,World,"['Bars and Nightclubs', 'Deaths (Fatalities)', 'Karaoke', 'Accidents and Safety']",454
"Alcaraz Leaves It (Very, Very) Late in Defeating Sinner at U.S. Open",2022-09-08,article,News,Sports,"['Tennis', 'United States Open (Tennis)']",1363
"Shock Waves Hit the Global Economy, Posing Grave Risk to Europe",2022-09-08,article,News,Business Day,"['Economic Conditions and Trends', 'United States Economy', 'Banking and Financial Institutions', 'Interest Rates', 'Electric Light and Power', 'Natural Gas', 'Oil (Petroleum) and Gasoline', 'Prices (Fares, Fees and Rates)', 'Recession and Depression', 'Embargoes and Sanctions', 'Coronavirus (2019-nCoV)', 'Russian Invasion of Ukraine (2022)', 'Supply Chain']",1480
"A Last Taste of Summer Theater, as Paris Heads Back to Work",2022-09-08,article,Review,Theater,"['Theater', 'Festivals', 'Affordable Housing']",1182
The Days of Energy Deregulation Are Over in Europe,2022-09-08,article,News,Business Day,"['Regulation and Deregulation of Industry', 'Politics and Government', 'Electric Light and Power', 'Natural Gas', 'Prices (Fares, Fees and Rates)', 'Economic Conditions and Trends', 'Russian Invasion of Ukraine (2022)']",1050
"Mr. Biden, Tear Down This Highway",2022-09-08,multimedia,Interactive Feature,Opinion,"['Infrastructure (Public Works)', 'Roads and Traffic', 'Segregation and Desegregation', 'Black People', 'Blacks', 'Urban Areas']",0
What Have Your Friends Taught You About Life?,2022-09-08,article,News,The Learning Network,[],825
Homeless Shelter Officer Is Suspended After Hitting a Resident,2022-09-08,article,News,New York,"['Police Brutality, Misconduct and Shootings']",830
Heading to the Rockaways for the Sand and the Subway. Which Apartment Did She Choose?,2022-09-08,multimedia,Interactive Feature,Real Estate,"['Real Estate and Housing (Residential)', 'Content Type: Personal Profile']",0
Poem: Photograph From September 11,2022-09-08,article,News,Magazine,"['Poetry and Poets', 'World Trade Center (Manhattan, NY)', 'September 11 (2001)']",308
The Libertine’s Voice: The Life and Love Poems of John Donne,2022-09-08,article,Review,Books,"['Books and Literature', 'Poetry and Poets', 'Content Type: Personal Profile']",1264
Judge John Hodgman on Adopting Cats While Drunk,2022-09-08,article,News,Magazine,"['Comedy and Humor', 'Pets']",173
"A Smartphone That Lasts a Decade? Yes, It’s Possible.",2022-09-08,article,News,Technology,"['Smartphones', 'iPhone', 'Innovation', 'Computers and the Internet', 'Batteries', 'Software', 'Cameras']",1276
Your Childhood Home Is in Front of You. Do You Go In?,2022-09-08,article,Op-Ed,Opinion,"['Pilots', 'Children and Childhood', 'Memory', 'Travel and Vacations', 'Writing and Writers']",1549
N.Y.C. Schools Reopen With Focus on Recovery From Pandemic Losses,2022-09-08,article,News,New York,"['Education (K-12)', 'Coronavirus (2019-nCoV)', 'Reading and Writing Skills (Education)']",1445
What to Know About Non-Hodgkin’s Lymphoma,2022-09-08,article,News,Well,"[""Non-Hodgkin's Lymphoma"", 'Cancer', 'Lymph Nodes and Lymphatic System']",702
15 Works of Nonfiction to Read This Fall,2022-09-08,article,News,Books,['Books and Literature'],999
The Novel That Made Karen Armstrong Quit Her Reading Group,2022-09-08,article,News,Books,"['Books and Literature', 'Religion and Belief', 'Content Type: Personal Profile']",2011
The Man Who Won the Republican Party Before Trump Did,2022-09-08,article,Op-Ed,Opinion,"['Presidential Election of 2020', 'Right-Wing Extremism and Alt-Right', 'Television', 'Democracy (Theory and Philosophy)', 'United States Politics and Government', 'Fringe Groups and Movements', 'Conservatism (US Politics)']",2645
Which States Offer the Largest Lot Sizes for Home Buyers?,2022-09-08,article,News,Real Estate,"['Real Estate and Housing (Residential)', 'Building (Construction)', 'Zoning', 'Housing Starts']",366
American Schools Got a $190 Billion Covid Windfall. Where Is It Going?,2022-09-08,article,News,Magazine,"['Coronavirus Aid, Relief, and Economic Security Act (2020)', 'Education (K-12)', 'American Rescue Plan (2021)', 'Coronavirus (2019-nCoV)', 'Education']",2871
Climate Change Could Worsen Supply Chain Turmoil,2022-09-08,article,News,Business Day,"['Global Warming', 'Supply Chain', 'Shortages', 'Drought', 'Protectionism (Trade)', 'International Trade and World Market']",1474
William Kent Krueger is BFF With His Most Famous Character,2022-09-08,article,News,Books,"['Books and Literature', 'Content Type: Personal Profile', 'Writing and Writers']",438
How Book Bans Turned a Texas Town Upside Down,2022-09-08,article,News,Magazine,"['Books and Literature', 'Libraries and Librarians', 'Censorship', 'Education (K-12)']",4476
Help! I Was Catfished by My Airbnb Host and the Place Was a Mess,2022-09-08,article,News,Travel,"['Travel and Vacations', 'Content Type: Service']",1388
"Trump Pushed Officials to Prosecute His Critics, Ex-U.S. Attorney Says",2022-09-08,article,News,New York,"['United States Attorneys', 'United States Politics and Government']",1990
Immortality Delayed Is Still Immortality,2022-09-08,article,News,Sports,"['Basketball', 'Football', 'Baseball', 'Halls of Fame', 'Coaches and Managers']",1309
How a Veteran Coach Learned to Stop Yelling and Start Collaborating,2022-09-08,article,News,Sports,"['Football', 'Coaches and Managers', 'Content Type: Personal Profile']",1547
"How the N.F.L. Stays So Popular, Despite Its Many Scandals",2022-09-08,article,News,Sports,"['Football', 'Public Relations and Publicity', 'Fans (Persons)', 'Ratings (Audience Measurement)']",1232
15 Memoirs and Biographies to Read This Fall,2022-09-08,article,News,Books,"['Books and Literature', 'Content Type: Personal Profile']",943
What Antarctica’s Disintegration Asks of Us,2022-09-08,article,Op-Ed,Opinion,"['Global Warming', 'Glaciers', 'Oceans and Seas', 'Coastal Areas', 'Ice']",1061
"When Teens Find Misinformation, These Teachers Are Ready",2022-09-08,article,News,Technology,"['Education (K-12)', 'Rumors and Misinformation', 'Computers and the Internet', 'News and News Media', 'Social Media', 'Children and Childhood', 'Law and Legislation']",1397
"In Maryland, Frances Tiafoe’s Former Home Rallies Behind Him",2022-09-08,article,News,Sports,"['Tennis', 'United States Open (Tennis)', 'Content Type: Personal Profile']",1437
The Best Red Carpet of the Year,2022-09-08,article,News,Style,"['Fashion and Apparel', 'Venice International Film Festival', 'Movies', 'Actors and Actresses']",870
"When Weird Al Yankovic Met Daniel Radcliffe, Things Got … Well, You Know",2022-09-08,article,News,Movies,"['Movies', 'Pop and Rock Music', 'Comedy and Humor', 'Content Type: Personal Profile', 'audio-neutral-immersive', 'audio-positive-nostalgic']",1855
33 Works of Fiction and Poetry Coming This Fall,2022-09-08,article,News,Books,"['Books and Literature', 'Poetry and Poets']",1862
"With Government Paralyzed and Militias Fighting, Iraq’s Instability Deepens",2022-09-08,article,News,World,"['Elections', 'Politics and Government', 'Defense and Military Forces']",1369
"To Probe Tornado Secrets, These Scientists Stalk Supercells",2022-09-08,article,News,U.S.,"['Weather', 'Tornadoes', 'Research']",1089
Twilight of Entrepreneurs in China as More Leave the Country,2022-09-08,article,News,Business Day,"['Politics and Government', 'High Net Worth Individuals', 'Real Estate and Housing (Residential)', 'Appointments and Executive Changes', 'Entrepreneurship', 'Economic Conditions and Trends']",1466
Is California Jump-Starting the Electric Vehicle Revolution?,2022-09-08,article,News,Podcasts,"['Automobiles', 'Electric and Hybrid Vehicles', 'Global Warming', 'audio-neutral-informative']",328
E.C.B. Raises Rates Aggressively to Tame Rising Prices,2022-09-08,article,News,Business Day,"['Inflation (Economics)', 'Economic Conditions and Trends', 'Interest Rates', 'Banking and Financial Institutions', 'Prices (Fares, Fees and Rates)', 'Government Bonds', 'Supply Chain']",1006
China’s Zero-Covid Approach Explained,2022-09-08,article,News,World,"['Coronavirus (2019-nCoV)', 'Politics and Government', 'Coronavirus Risks and Safety Concerns', 'Quarantines']",921
Covid’s Toll on Native Americans,2022-09-08,article,briefing,Briefing,"['internal-storyline-no', 'Deaths (Fatalities)', 'Native Americans', 'Health Insurance and Managed Care', 'Coronavirus (2019-nCoV)']",1717
"‘House of Darkness’ Review: If You Prick Them, Do Bros Not Bleed?",2022-09-08,article,Review,Movies,['Movies'],300
‘Pinocchio’ Review: As the Story Grows,2022-09-08,article,Review,Movies,['Movies'],473
‘Medieval’ Review: Flaying Alive,2022-09-08,article,Review,Movies,['Movies'],300
‘The Story of Film: A New Generation’ Review: The Case for Modern Movies,2022-09-08,article,Review,Movies,"['Movies', 'Documentary Films and Programs']",318
‘Speak No Evil’ Review: Impolite Company,2022-09-08,article,Review,Movies,['Movies'],412
‘Clerks III’ Review: From the Heart,2022-09-08,article,Review,Movies,['Movies'],425
‘Hold Me Tight’ Review: An Étude in the Key of Grief,2022-09-08,article,Review,Movies,['Movies'],514
‘The Bengali’ Review: A Woman Reconnecting to Her Roots,2022-09-08,article,Review,Movies,"['Documentary Films and Programs', 'Black People', 'Blacks', 'Indian-Americans', 'Immigration and Emigration', 'Content Type: Personal Profile']",313
‘The Anthrax Attacks’ Review: Strange Behavior and an Incriminating Flask,2022-09-08,article,Review,Movies,"['Documentary Films and Programs', 'ANTHRAX', 'Biological and Chemical Warfare']",325
"The 1975’s Matty Healy Is Still Trying to Be Funny, Sincerely",2022-09-08,article,News,Arts,"['Pop and Rock Music', 'Content Type: Personal Profile']",2183
More Than 90 Art Shows and Exhibitions to See This Fall,2022-09-08,article,News,Arts,"['Art', 'Sculpture', 'Museums']",3902
40 TV Shows to Watch This Fall,2022-09-08,article,News,Arts,['Television'],2719
"Classical Music and Opera This Fall: 59 Programs, Premieres and More",2022-09-08,article,News,Arts,"['Classical Music', 'Opera']",4593
More Than 60 Plays and Musicals to Take In This Fall,2022-09-08,article,News,Theater,"['Theater', 'Theater (Broadway)']",5684
"75 Pop and Jazz Albums, Shows and Festivals Coming This Fall",2022-09-08,article,News,Arts,"['Music', 'Rhythm and Blues (Music)', 'Folk Music', 'Jazz', 'Pop and Rock Music', 'Rap and Hip-Hop']",8299
"54 Dance Programs, Festivals and More Coming This Fall",2022-09-08,article,News,Arts,['Dancing'],4470
"159 Films, for Every Taste, Coming This Fall",2022-09-08,article,News,Movies,['Movies'],7381
U.K.’s New Leader Lays Out Sweeping Plan to Cap Energy Prices,2022-09-08,article,News,World,"['Politics and Government', 'Prices (Fares, Fees and Rates)', 'Energy and Power', 'Economic Conditions and Trends', 'Offshore Drilling and Exploration', 'Natural Gas', 'Electric Light and Power']",1600
"The body of a British aid worker captured by Russian proxies showed signs of torture, a Ukrainian official says.",2022-09-08,article,News,World,"['Russian Invasion of Ukraine (2022)', 'Torture', 'War Crimes, Genocide and Crimes Against Humanity', 'Humanitarian Aid']",380
‘True Things’ Review: Escape Routes,2022-09-08,article,Review,Movies,['Movies'],282
BlackRock Seeks to Defend Its Reputation Over E.S.G. Fight,2022-09-08,article,News,Business Day,"['Social Media', 'Supply Chain', 'Energy and Power']",1860
Michelle Obama’s White House Portrait: Arms and the Woman,2022-09-08,article,News,Style,"['United States Politics and Government', 'First Ladies (US)', 'Fashion and Apparel', 'your-feed-fashion']",743
Chess Replay: You Versus Paschitta,2022-09-08,article,News,Crosswords & Games,[],94
‘CoComelon’ Video Game Is a First for Fast-Growing Moonbug,2022-09-08,article,News,Business Day,"['Computer and Video Games', 'Nintendo Switch (Video Game System)', 'Babies and Infants', 'Children and Childhood', 'Television']",377
The Artist Sculpting a Terra-Cotta Forest,2022-09-08,article,News,T Magazine,"['Art', 'Cosmetics and Toiletries']",1391
"Can Architecture Build Values, Too?",2022-09-08,article,News,Arts,['ARCHITECTURE'],2395
On the Market in New York City,2022-09-08,multimedia,Slideshow,Real Estate,['Real Estate and Housing (Residential)'],0
Homes for Sale in Brooklyn and Manhattan,2022-09-08,article,News,Real Estate,['Real Estate and Housing (Residential)'],186
On the Market in the New York Region,2022-09-08,multimedia,Slideshow,Real Estate,['Real Estate and Housing (Residential)'],0
Homes for Sale in New York and New Jersey,2022-09-08,article,News,Real Estate,['Real Estate and Housing (Residential)'],184
How California Officials Are Trying to Keep the Lights On,2022-09-08,article,briefing,U.S.,[],1728
Jerome Powell speaks on monetary policy.,2022-09-08,article,News,Business Day,[],64
U.S. Open Semifinals: The 4 Women Left,2022-09-08,multimedia,Interactive Feature,Sports,"['Tennis', 'United States Open (Tennis)']",0
Saudi-Tied Tournament Causes Push to Void Trump’s N.Y.C. Golf Contract,2022-09-08,article,News,New York,"['Golf', 'Government Contracts and Procurement', 'Politics and Government']",1183
Bannon Pleads Not Guilty to New York Charges in Wall Case,2022-09-08,article,News,New York,"['Embezzlement', 'Amnesties, Commutations and Pardons']",1270
