headline,date,doc_type,material_type,section,keywords,word_count
Review: ‘Marie It’s Time’ Pieces Together a Woman in Fragments,2022-09-19,article,Review,Theater,"['Theater', 'Actors and Actresses']",626
"In the eastern Donbas, a slew of contradictions.",2022-09-19,article,News,World,[],391
"Burnout, Productivity and Other Tales of the Office",2022-09-19,article,Letter,Opinion,"['Workplace Environment', 'Telecommuting', 'Coronavirus (2019-nCoV)', 'Democracy (Theory and Philosophy)', 'United States Politics and Government', 'Russian Invasion of Ukraine (2022)', 'Education (K-12)', 'Newspapers']",1120
"Bad Bunny, No. 1 Again, Puts a Spotlight on Inequities in Puerto Rico",2022-09-19,article,News,Arts,"['Pop and Rock Music', 'Rap and Hip-Hop', 'Documentary Films and Programs', 'Income Inequality']",425
Wall Street Is on Edge as It Tries to Guess What the Fed Is Thinking,2022-09-19,article,News,Business Day,"['Stocks and Bonds', ""Standard & Poor's 500-Stock Index"", 'Interest Rates', 'United States Economy', 'Inflation (Economics)']",818
See the Destruction Left in Hurricane Fiona’s Wake,2022-09-19,article,News,U.S.,"['Hurricanes and Tropical Storms', 'Floods', 'Weather']",211
"From Coronation to Funeral: Bookends to the Life of a Queen, and a Generation",2022-09-19,article,News,World,['Funerals and Memorials'],1155
Three Reasons Puerto Rico Is in the Dark,2022-09-19,article,News,Climate,"['United States Politics and Government', 'Power Failures and Blackouts', 'Disasters and Emergencies', 'Hurricane Fiona (2022)', 'Global Warming', 'Electric Light and Power']",783
"Nissan Recalls Over 203,000 Pickups That May Roll Away While Parked",2022-09-19,article,News,Business Day,"['Sports Utility Vehicles and Light Trucks', 'Recalls and Bans of Products', 'Automobile Safety Features and Defects']",374
Waving Goodbye to ‘Dear Evan Hansen’,2022-09-19,article,News,Theater,"['Theater', 'Content Type: Personal Profile', 'Theater (Broadway)']",1368
Don’t Let Republicans Off the Hook on Same-Sex Marriage,2022-09-19,article,Op-Ed,Opinion,"['Same-Sex Marriage, Civil Unions and Domestic Partnerships', 'United States Politics and Government', 'Law and Legislation', 'Midterm Elections (2022)']",883
Her Majesty’s Last Broadcast,2022-09-19,article,News,Arts,"['Television', 'Funerals and Memorials', 'Royal Families', 'News and News Media']",1218
"In Parks and on Post Boxes, Crowds Say Farewell to the Queen",2022-09-19,article,News,World,['Funerals and Memorials'],1231
This Acrobatic Hunting Trick Is Straight Out of the Spider-Verse,2022-09-19,article,News,Science,"['Spiders', 'Ants', 'Animal Behavior', 'Research', 'your-feed-science', 'your-feed-animals']",665
"Windsor, Queen’s Final Resting Place, Has a Long Association With Her",2022-09-19,article,News,World,['Funerals and Memorials'],822
"Social Media Companies Still Boost Election Fraud Claims, Report Says",2022-09-19,article,News,Technology,"['Project Democracy', 'Midterm Elections (2022)', 'Social Media', 'Computers and the Internet', 'Voter Fraud (Election Fraud)', 'Rumors and Misinformation', 'Presidential Election of 2020']",575
"Alain Tanner, Leading Director in Swiss New Wave, Dies at 92",2022-09-19,article,Obituary (Obit),Movies,"['Movies', 'Deaths (Obituaries)']",962
"In a Season of Frustration, the Brewers Are Still Fighting",2022-09-19,article,News,Sports,['Baseball'],1136
Judge Vacates Murder Conviction of Adnan Syed of ‘Serial’,2022-09-19,article,News,U.S.,"['Decisions and Verdicts', 'Murders, Attempted Murders and Homicides', 'Prosecutorial Misconduct', 'False Arrests, Convictions and Imprisonments']",1325
The New York City Ban on Foie Gras Is Delayed,2022-09-19,article,News,Food,"['Cooking and Cookbooks', 'Knives', 'Books and Literature', 'Bakeries and Baked Products', 'Bread']",757
Top Aide Who Fueled Eric Adams’s Rise Will Resign at End of Year,2022-09-19,article,News,New York,"['Appointments and Executive Changes', 'Politics and Government']",873
Earthquake Shakes Mexico on Anniversary of 2 Major Temblors,2022-09-19,article,News,World,['Earthquakes'],337
Law Enforcement Funding Package Splits Democrats Ahead of Midterm Elections,2022-09-19,article,News,U.S.,"['Law and Legislation', 'Police', 'Crime and Criminals', 'United States Politics and Government', 'Midterm Elections (2022)']",1227
"Most of the 146 bodies exhumed in Izium so far were civilians, a Ukrainian official said.",2022-09-19,article,News,World,[],349
"Valery Polyakov, Who Took the Longest Journey in Space, Dies at 80",2022-09-19,article,Obituary (Obit),Science,"['Space and Astronomy', 'Space Stations', 'Records and Achievements', 'Deaths (Obituaries)']",315
Near Miss at a Nuclear Site,2022-09-19,article,News,Briefing,['Russian Invasion of Ukraine (2022)'],1139
The Choreography of Public Mourning,2022-09-19,article,News,Arts,['Funerals and Memorials'],904
Thousands Pay Tribute as Britain Says Final Farewell to Its Queen,2022-09-19,article,News,World,"['Royal Families', 'Funerals and Memorials', 'Politics and Government']",1576
Your Tuesday Briefing: Britain Buries Queen Elizabeth II,2022-09-19,article,briefing,Briefing,"['Elections', 'War and Armed Conflicts', 'Politics and Government', 'International Relations', 'United States International Relations', 'Funerals and Memorials', 'Russian Invasion of Ukraine (2022)']",1227
The Second Coming of the Appletini,2022-09-19,article,News,Food,"['Bars and Nightclubs', 'Cocktails and Mixed Drinks']",931
"Coach Leonard Hamilton: ‘The Worse the Program, the More I Became Interested’",2022-09-19,article,News,Sports,"['Black People', 'Blacks', 'Coaches and Managers', 'Draft and Recruitment (Sports)', 'NCAA Basketball Championships (Men)', 'College Athletics', 'Basketball (College)', 'Awards, Decorations and Honors', 'Content Type: Personal Profile']",1503
Physics Body Concedes Mistakes in Study of Missile Defense,2022-09-19,article,News,Science,"['Missiles and Missile Defense Systems', 'Drones (Pilotless Planes)', 'United States Defense and Military Forces', 'Nuclear Weapons', 'Physics', 'your-feed-science']",1139
O.S.C.E. condemns 13-year prison term for two staff members in occupied territory as ‘repugnant.’,2022-09-19,article,News,World,['Russian Invasion of Ukraine (2022)'],368
Your Monday Evening Briefing,2022-09-19,article,briefing,Briefing,[],1287
Ford Says It Will Spend $1 Billion More in Third Quarter Because of Supply Chain Problems,2022-09-19,article,News,Business Day,"['Automobiles', 'Supply Chain', 'Company Reports', 'Shortages']",241
Scholars Ask Congress to Scrap Winner-Take-All Political System,2022-09-19,article,News,U.S.,"['United States Politics and Government', 'internal-sub-only-nl', 'Redistricting and Reapportionment']",1649
Strike Near Another Ukrainian Nuclear Plant Escalates Fears of Disaster,2022-09-19,article,News,World,"['Russian Invasion of Ukraine (2022)', 'Defense and Military Forces', 'Nuclear Energy', 'Infrastructure (Public Works)']",1259
Pentagon Orders Review of Its Overseas Social Media Campaigns,2022-09-19,article,News,U.S.,"['Social Media', 'Rumors and Misinformation', 'United States Politics and Government', 'United States Defense and Military Forces']",806
"DeSantis’s Migrant Flights Aim to Jolt Midterms, and Lay Groundwork for 2024",2022-09-19,article,News,U.S.,"['Midterm Elections (2022)', 'United States Politics and Government', 'Illegal Immigration', 'Conservatism (US Politics)']",952
Trump Was Warned Late Last Year of Potential Legal Peril Over Documents,2022-09-19,article,News,U.S.,"['United States Politics and Government', 'Archives and Records', 'Classified Information and State Secrets']",1051
California Woman Who Faked Her Own Abduction Gets 18 Months in Prison,2022-09-19,article,News,U.S.,"['Kidnapping and Hostages', 'Social Security (US)', 'Hoaxes and Pranks']",716
Robert Fripp Lightens Up,2022-09-19,article,News,Arts,"['Pop and Rock Music', 'Content Type: Personal Profile', 'Web-Original Programming', 'Coronavirus (2019-nCoV)']",1920
Biden Says the Pandemic Is Over. But at Least 400 People Are Dying Daily.,2022-09-19,article,News,U.S.,"['Coronavirus (2019-nCoV)', 'Disease Rates', 'Deaths (Fatalities)', 'Chronic Fatigue Syndrome', 'Long Covid', 'United States Politics and Government']",1196
Arrests at Southwestern Border Exceed 2 Million in a Year for the First Time,2022-09-20,article,News,U.S.,"['United States Politics and Government', 'Illegal Immigration', 'Immigration and Emigration', 'Asylum, Right of']",612
"Russia is struggling to attract new recruits for its army, a U.S. official says.",2022-09-20,article,News,World,"['Russian Invasion of Ukraine (2022)', 'Weapons', 'War and Armed Conflicts']",600
Criminal Investigation Is Opened After Migrant Flights to Martha’s Vineyard,2022-09-20,article,News,U.S.,"['Immigration and Emigration', 'Illegal Immigration', 'Asylum, Right of', 'Sheriffs']",580
Chris Redd Is Latest Cast Member to Leave ‘S.N.L.’,2022-09-20,article,News,Arts,['Television'],261
"Buldak, the Fiery Korean Chicken Dish, Gets the Pizza Treatment",2022-09-20,article,News,Food,"['Cooking and Cookbooks', 'Pizza', 'Poultry', 'Korean Food (Cuisine)']",900
Put Two and Two Together,2022-09-20,article,News,Crosswords & Games,['Crossword Puzzles'],920
Videos Show Trump Allies Handling Georgia Voting Equipment,2022-09-20,article,News,U.S.,"['Presidential Election of 2020', 'Voting Machines', 'Voter Fraud (Election Fraud)', 'Suits and Litigation (Civil)', 'Video Recordings, Downloads and Streaming']",1017
"In One Corner of Kosovo, Cheers Still Ring Out for Putin",2022-09-20,article,News,World,"['International Relations', 'Defense and Military Forces', 'Russian Invasion of Ukraine (2022)']",1411
"Corrections: Sept. 20, 2022",2022-09-20,article,News,Corrections,[],440
"Quotation of the Day: With Sadness and Uncertainty, Britons Close an Elizabethan Age",2022-09-20,article,Quote,Today’s Paper,[],40
Your Tuesday Briefing,2022-09-20,article,briefing,Briefing,[],1344
Sweden Is Becoming Unbearable,2022-09-20,article,Op-Ed,Opinion,"['Right-Wing Extremism and Alt-Right', 'Elections', 'Refugees and Displaced Persons', 'Crime and Criminals']",1294
Winter Forecast: Gas and Electric Bills Will Soar,2022-09-20,article,briefing,New York,"['Prices (Fares, Fees and Rates)', 'Heating', 'Electric Light and Power', 'Natural Gas']",1504
Late Night Recaps the Queen’s Funeral,2022-09-20,article,News,Arts,"['internal-sub-only', 'Television', 'Funerals and Memorials', 'Comedy and Humor']",426
Word of the Day: epicure,2022-09-20,article,News,The Learning Network,[],379
Norway’s $1.2 Trillion Investment Fund Sets 2050 Climate Target,2022-09-20,article,News,Business Day,"['Politics and Government', 'Global Warming', 'Greenhouse Gas Emissions', 'Stocks and Bonds', 'Corporations']",558
Protests Erupt in Iranian Cities After Woman’s Death in Custody,2022-09-20,article,News,World,"['Muslim Veiling', 'Demonstrations, Protests and Riots', 'Deaths (Fatalities)', ""Women's Rights""]",895
Broadway Favorites,2022-09-20,article,News,The Learning Network,[],125
Spelling Bee Forum,2022-09-20,article,News,Crosswords & Games,[],165
"The Godwit’s Long, Long Nonstop Journey",2022-09-20,article,News,Science,"['Birds', 'Animal Migration', 'Research', 'your-feed-science']",1627
"When Fossils Are Accidentally Dug Up, the Job Site Becomes a Science Lab",2022-09-20,article,News,U.S.,"['Paleontology', 'Dinosaurs', 'Fossils', 'Building (Construction)']",1564
How a Quebec Lithium Mine May Help Make Electric Cars Affordable,2022-09-20,article,News,Business Day,"['Electric and Hybrid Vehicles', 'Batteries', 'Metals and Minerals', 'Mines and Mining', 'Lithium (Metal)', 'Automobiles', 'Factories and Manufacturing', 'Prices (Fares, Fees and Rates)', 'Inflation Reduction Act of 2022', 'Global Warming', 'International Trade and World Market']",1489
Lesson Plan: The Debate Over the Teaching of U.S. History,2022-09-20,article,News,The Learning Network,[],1040
"YouTube’s Dislike Button Rarely Shifts Recommendations, Researchers Say",2022-09-20,article,News,Technology,"['Video Recordings, Downloads and Streaming', 'Artificial Intelligence', 'Research', 'Computers and the Internet', 'Social Media', 'Rumors and Misinformation', 'Conspiracy Theories']",660
‘Serial’: Season 2,2022-09-20,article,News,Podcasts,"['Terrorism', 'United States Defense and Military Forces', 'AIRLINES AND AIRPLANES', 'Prisons and Prisoners', 'Prisoners of War', 'Desertion (Military)', 'Afghanistan War (2001- )']",882
Who Is Going to Therapy in America?,2022-09-20,multimedia,Interactive Feature,Opinion,['Mental Health and Disorders'],0
It’s Not Just You,2022-09-20,multimedia,Interactive Feature,Opinion,[],0
Understanding Green Infrastructure,2022-09-20,multimedia,Interactive Feature,U.S.,[],0
What Is the Purpose of Teaching U.S. History?,2022-09-20,article,News,The Learning Network,[],689
Do You Need a ‘Correct Attitude’ to Understand Your Mind?,2022-09-20,article,Op-Ed,Opinion,"['Psychiatry and Psychiatrists', 'Schizophrenia', 'Loneliness', 'Psychology and Psychologists', 'Language and Languages', 'Mental Health and Disorders']",1438
"To Really Understand the Ocean, We Need to Go Back in Time",2022-09-20,article,Op-Ed,Opinion,"['Fish and Other Marine Life', 'Sustainable Living', 'Oceans and Seas']",937
We Have Reached Peak ‘Mental Health’,2022-09-20,article,Op-Ed,Opinion,"['Mental Health and Disorders', 'Depression (Mental)', 'Anxiety and Stress', 'Psychology and Psychologists', 'Therapy and Rehabilitation']",1544
"In ‘Reboot,’ Everything Old Is New, to Streaming",2022-09-20,article,News,Arts,['Television'],1384
Perfectly Reasonable Question: Can We Trust the Polls?,2022-09-20,article,News,The Upshot,"['Midterm Elections (2022)', 'United States Politics and Government', 'internal-sub-only-nl', 'Polls and Public Opinion', 'Presidential Election of 2020']",1214
Mental Health Is Political,2022-09-20,article,Op-Ed,Opinion,"['Mental Health and Disorders', 'Anxiety and Stress', 'Psychiatry and Psychiatrists', 'Drugs (Pharmaceuticals)', 'Poverty']",2245
The Gamification of Humanity,2022-09-20,article,Review,Books,"['Books and Literature', 'Mobile Applications', 'Computer and Video Games', 'Corporations', 'Motivation and Incentive Programs']",785
The Single Best Guide to Decarbonization I’ve Heard,2022-09-20,article,Op-Ed,Opinion,"['Energy and Power', 'Greenhouse Gas Emissions', 'Infrastructure (Public Works)', 'Global Warming', 'Electric Light and Power', 'Inflation Reduction Act of 2022', 'Law and Legislation', 'United States Politics and Government', 'audio-neutral-informative']",375
The Redistricting Mess Comes to New York’s City Council,2022-09-20,article,News,New York,"['Redistricting and Reapportionment', 'Asian-Americans', 'Voting Rights Act (1965)']",1221
‘Serial’: Season 1,2022-09-20,article,News,Podcasts,"['Murders, Attempted Murders and Homicides', 'Education (K-12)', 'Domestic Violence', 'Dating and Relationships']",823
Speeding Up Your Daily Walk Could Have Big Benefits,2022-09-20,article,News,Well,"['Heart', 'Research', 'Blood Pressure', 'Walking', 'Running', 'Exercise']",918
Egypt Feels Pain of Global Disruptions Wrought by War and Pandemic,2022-09-20,article,News,World,"['Economic Conditions and Trends', 'Politics and Government', 'International Trade and World Market', 'International Relations', 'Coronavirus (2019-nCoV)', 'Russian Invasion of Ukraine (2022)']",1390
What Comes Next in the Fed’s Fight Against Inflation?,2022-09-20,article,News,Business Day,"['Inflation (Economics)', 'Interest Rates', 'Banking and Financial Institutions', 'Prices (Fares, Fees and Rates)', 'United States Economy']",1392
Do Antidepressants Work for Severe PMS?,2022-09-20,article,News,Well,"['Women and Girls', 'Premenstrual Syndrome (PMS)', 'Depression (Mental)', 'Mental Health and Disorders', 'Anxiety and Stress', 'Content Type: Service', 'Research', 'Reproduction (Biological)', 'Hormones', 'Menstruation', 'Birth Control and Family Planning']",1325
Glenn Youngkin Knows Exactly What He’s Doing,2022-09-20,article,Op-Ed,Opinion,"['United States Politics and Government', 'Presidential Election of 2020', 'Civil Rights Movement (1954-68)', 'PRESIDENTIAL ELECTION OF 1948', 'Liberalism (US Politics)', 'Conservatism (US Politics)', 'Presidents and Presidency (US)']",1567
Billions in Climate Deal Funding Could Help Protect U.S. Coastal Cities,2022-09-20,article,News,U.S.,"['Global Warming', 'Coastal Areas', 'Coast Erosion', 'Infrastructure (Public Works)', 'Area Planning and Renewal', 'American Jobs Plan (2021)', 'Inflation Reduction Act of 2022', 'Wetlands', 'United States Politics and Government']",1365
Your Mental Health Isn’t Just About You,2022-09-20,multimedia,Interactive Feature,Opinion,[],0
‘Very Harmful’ Lack of Data Blunts U.S. Response to Outbreaks,2022-09-20,article,News,U.S.,"['Coronavirus (2019-nCoV)', 'Monkeypox', 'Disease Rates', 'Electronic Health Records', 'Vaccination and Immunization', 'Medicine and Health', 'Data-Mining and Database Marketing']",2805
"In Istanbul’s Private Retreats of the Sultans, Time Stands Still",2022-09-20,article,News,Travel,"['Ottoman Empire', 'Travel and Vacations', 'ARCHITECTURE', 'Palaces and Castles', 'Muslims and Islam']",1457
It’s Never Too Late to ‘Fly’ on a Trapeze,2022-09-20,article,News,Style,"['Content Type: Personal Profile', 'Movies', 'Theater']",1311
The Enduring Wisdom of ‘Goodnight Moon’,2022-09-20,article,News,Books,"['internal-sub-only', 'Books and Literature', 'Children and Childhood', 'Parenting', 'Babies and Infants', 'Writing and Writers']",1722
Dinner in Seven Ingredients (or Even Fewer!),2022-09-20,article,News,Food,"['Cooking and Cookbooks', 'Recipes']",2260
A Buyer With a Vision Builds Her Own Hamptons Home,2022-09-20,multimedia,Slideshow,Real Estate,"['Real Estate and Housing (Residential)', 'Interior Design and Furnishings', 'Restoration and Renovation', 'ARCHITECTURE', 'Home Repairs and Improvements', 'Furniture', 'Lighting', 'Design']",0
One Frustrated Hamptons Buyer Opts for an Alternative: Build It Yourself,2022-09-20,article,News,Real Estate,"['Real Estate and Housing (Residential)', 'Interior Design and Furnishings', 'Furniture', 'Lighting', 'Sustainable Living']",847
‘Serial’: Season 3,2022-09-20,article,News,Podcasts,['Police'],662
"At a Moment in London Like No Other, Fashion Forges Ahead",2022-09-20,article,News,Style,"['Fashion and Apparel', 'London Fashion Week']",1066
Film Club: ‘What the Pandemic Can Teach Us About Endings’,2022-09-20,article,News,The Learning Network,[],398
"Adnan Syed, Freed",2022-09-20,article,briefing,Briefing,"['False Arrests, Convictions and Imprisonments', 'Podcasts']",1695
Here’s what to expect as world leaders address the United Nations.,2022-09-20,article,News,World,[],454
Why Adnan Syed Was Released From Prison,2022-09-20,article,News,Podcasts,"['Prisons and Prisoners', 'Decisions and Verdicts', 'Murders, Attempted Murders and Homicides', 'False Arrests, Convictions and Imprisonments', 'audio-neutral-informative']",385
Mets Clinch Playoff Spot With Scherzer’s 200th Win,2022-09-20,article,News,Sports,['Baseball'],822
These Women Used the Rule of Law to Challenge Trumpism,2022-09-20,article,Review,Books,"['Women and Girls', 'Books and Literature', '#MeToo Movement', 'Sexual Harassment', 'Law and Legislation', 'Abortion', 'Constitution (US)']",1225
Yvon Chouinard Is the Founder of Patagonia. He’s Also My ‘Dirtbag’ Friend.,2022-09-20,article,Op-Ed,Opinion,"['Land Use Policies', 'Wilderness Areas', 'Global Warming', 'Mountaineering']",1157
Who gets to use gas?,2022-09-20,article,News,Climate,"['Natural Gas', 'Alternative and Renewable Energy', 'Global Warming', 'Greenhouse Gas Emissions', 'internal-storyline-no', 'internal-sub-only-nl']",1346
"In His Vancouver Home, a Lighting Designer Embraces a Natural Glow",2022-09-20,article,News,T Magazine,"['ARCHITECTURE', 'Lighting', 'Design']",844
Es Devlin’s Next Stage,2022-09-20,article,News,Theater,"['Theater', 'Art', 'Content Type: Personal Profile']",1130
An Anti-E.S.G. Activist Takes on Apple and Disney,2022-09-20,article,News,Business Day,['Venture Capital'],1862
Erdogan says Russia should return all captured Ukrainian territory.,2022-09-20,article,News,World,"['War and Armed Conflicts', 'Russian Invasion of Ukraine (2022)']",484
"For New Yorkers, 6 p.m. Is the New 8 p.m.",2022-09-20,article,News,T Magazine,['Restaurants'],826
1922: Ex-Kaiser to Marry Princess Hermine,2022-09-20,article,News,World,[],248
Ukraine advances deeper into areas that were held by Russia.,2022-09-20,article,News,World,[],619
Spotify Makes a Bet on Audiobooks,2022-09-20,article,News,Books,"['Audiobooks', 'Books and Literature', 'Book Trade and Publishing']",803
"To Expand, Arts Centers Seek to Build Their Own Community",2022-09-20,article,News,Business Day,"['Museums', 'Finances', 'Real Estate and Housing (Residential)', 'Real Estate (Commercial)', 'Area Planning and Renewal', 'Mixed-Use Developments']",1247
"Storms Slow California’s Mosquito Fire, but Bring Flash Flood Risk",2022-09-20,article,briefing,U.S.,[],1139
Seven Looks That Defined New York Fashion Week,2022-09-20,multimedia,Interactive Feature,Style,"['New York Fashion Week', 'Fashion and Apparel', 'Design']",0
A Virginia University Will Pay Hazing Victim’s Family Nearly $1 Million,2022-09-20,article,News,U.S.,"['Deaths (Fatalities)', 'Hazing', 'Colleges and Universities', 'Fraternities and Sororities']",513
Bad Bunny Leads 2022 Latin Grammy Nominations With 10,2022-09-20,article,News,Arts,"['Rap and Hip-Hop', 'Pop and Rock Music', 'Latin Music']",752
Maker of the Theragun Massage Device Raises $165 Million,2022-09-20,article,News,Business Day,"['Private Equity', 'Massage']",332
Colin Hanks Finds Perfection in ‘What We Do in the Shadows’ and Tacos at Every Meal,2022-09-20,article,News,Arts,"['Content Type: Personal Profile', 'Television']",1113
‘Four Saints in Three Acts’ Review: An Opera Becomes a One-Man Show,2022-09-20,article,Review,Theater,['Theater'],672
"Chamath Palihapitiya, a ‘SPAC King,’ Will Wind Down Two Funds",2022-09-20,article,News,Business Day,"['Special Purpose Acquisition Companies (SPAC)', 'Initial Public Offerings']",602
Western Nations Will Take Temperature on Proposed Russian Oil Price Cap,2022-09-20,article,News,World,"['Prices (Fares, Fees and Rates)', 'United States International Relations', 'War and Armed Conflicts', 'Oil (Petroleum) and Gasoline', 'Russian Invasion of Ukraine (2022)']",573
How to Hunt Like an Octopus,2022-09-20,article,News,Science,"['Octopus', 'Hunting and Trapping', 'Senses and Sensation', 'Animal Behavior', 'Animal Cognition', 'Brain', 'Research', 'your-feed-science', 'your-feed-animals']",645
The ‘Cost’ of Voting in America: A Look at Where It’s Easiest and Hardest,2022-09-20,multimedia,Interactive Feature,U.S.,"['States (US)', 'Voting Rights, Registration and Requirements', 'Midterm Elections (2022)', 'Voting and Voters', 'Absentee Voting']",0
"Lots of Food Gets Tossed. These Apps Let You Buy It, Cheap.",2022-09-20,article,News,Climate,"['Food', 'Waste Materials and Disposal', 'Mobile Applications', 'Restaurants', 'Supermarkets and Grocery Stores', 'Food Insecurity', 'Global Warming', 'Greenhouse Gas Emissions']",1480
Justice Dept. Charges 48 in Brazen Pandemic Aid Fraud in Minnesota,2022-09-20,article,News,U.S.,"['Frauds and Swindling', 'Nonprofit Organizations', 'Federal Aid (US)', 'Coronavirus (2019-nCoV)', 'Children and Childhood', 'United States Politics and Government', 'Coronavirus Aid, Relief, and Economic Security Act (2020)']",1570
Transcript: Ezra Klein Interviews Jesse Jenkins,2022-09-20,article,Op-Ed,Podcasts,[],19087
Does the world want 1.1 billion people to stop smoking–or not?,2022-09-20,multimedia,Video,T Brand,[],0
"NBC Revives Tarnished Golden Globe Telecast, Citing Reforms",2022-09-20,article,News,Business Day,"['Golden Globes (Awards)', 'Television', 'Ethics and Official Misconduct', 'Movies']",1239
New York City Subway System to Install Security Cameras in Train Cars,2022-09-20,article,News,New York,"['Subways', 'Security and Warning Systems', 'Cameras', 'Brooklyn, NY, Subway Shooting (April 12, 2022)']",1168
Will North Carolina’s Senate Race Break Democratic Hearts Again?,2022-09-20,article,News,U.S.,"['Elections, Senate', 'Polls and Public Opinion', 'Voting and Voters', 'Midterm Elections (2022)', 'United States Politics and Government']",1607
New York City Ends Private Employer Vaccine Mandate and Pushes Boosters,2022-09-20,article,News,New York,"['Coronavirus (2019-nCoV)', 'Vaccination and Immunization', 'Government Employees']",1122
Met Appoints New Leader of Modern and Contemporary Art,2022-09-20,article,News,Arts,"['Museums', 'Appointments and Executive Changes', 'Content Type: Personal Profile']",581
America’s Most Interesting Opera Destination? The Midwest.,2022-09-20,article,News,Arts,['Opera'],1322
Republican Governors to Migrants: Go Away,2022-09-20,article,Letter,Opinion,"['Immigration and Emigration', 'United States Politics and Government', 'Governors (US)', 'Coronavirus (2019-nCoV)', 'Abortion', 'Doctors', 'Russian Invasion of Ukraine (2022)']",1162
The Multiplying Horror of Ti West,2022-09-20,article,News,Movies,['Movies'],963
"‘Firebuds’ Gives a Face to Emergency Workers, and Their Vehicles",2022-09-20,article,News,Arts,"['Television', 'Children and Childhood', 'Volunteers and Community Service']",1376
How long should I wait to get a bivalent booster if I recently had a shot or contracted Covid?,2022-09-20,article,News,Well,"['Coronavirus (2019-nCoV)', 'Coronavirus Omicron Variant', 'Vaccination and Immunization']",201
Does the bivalent booster entirely replace the other boosters?,2022-09-20,article,News,Well,"['Coronavirus (2019-nCoV)', 'Coronavirus Omicron Variant', 'Vaccination and Immunization']",90
