headline,date,doc_type,material_type,section,keywords,word_count
Britain’s Inflation Rate Slows Slightly to 9.9 Percent,2022-09-14,article,News,Business Day,"['Prices (Fares, Fees and Rates)', 'Inflation (Economics)', 'Economic Conditions and Trends']",849
"Who Won and Lost in New Hampshire, Rhode Island and Delaware",2022-09-14,article,News,U.S.,"['Midterm Elections (2022)', 'Primaries and Caucuses', 'United States Politics and Government']",528
Annoying Noises,2022-09-14,article,News,The Learning Network,[],124
Spelling Bee Forum,2022-09-14,article,News,Crosswords & Games,[],165
From the Amazon to Patagonia: One Bureau Chief’s Terrain,2022-09-14,article,News,Times Insider,[],693
An Oily Challenge: Evict Stinky Old Furnaces in Favor of Heat Pumps,2022-09-14,article,News,Climate,"['Heating', 'Buildings (Structures)', 'Real Estate and Housing (Residential)', 'Energy Efficiency', 'Electric Light and Power', 'Inflation Reduction Act of 2022', 'Global Warming', 'Greenhouse Gas Emissions', 'Oil (Petroleum) and Gasoline']",1698
"How Fierce Primaries, Abortion and Inflation Transformed the 2022 Map",2022-09-14,article,News,U.S.,"['Midterm Elections (2022)', 'United States Politics and Government', 'Elections, Senate', 'Elections, House of Representatives', 'Primaries and Caucuses']",1490
"For the Very Rich, $3,200 a Night is a ‘Prototypical’ New York Experience",2022-09-14,article,briefing,New York,"['internal-storyline-no', 'Hotels and Travel Lodgings']",1503
China’s Leader Emerges From Covid Bubble for First Foreign Trip Since 2020,2022-09-14,article,News,World,"['International Relations', 'Coronavirus (2019-nCoV)']",1285
Painting the Town Blood-Red,2022-09-14,article,Review,Books,['Books and Literature'],666
China Is Running Covert Operations That Could Seriously Overwhelm Us,2022-09-14,article,Op-Ed,Opinion,"['Espionage and Intelligence Services', 'Cyberwarfare and Defense', 'Politics and Government', 'United States International Relations', 'International Relations']",1137
"These Romantics Celebrated the Self, to a Fault",2022-09-14,article,Review,Books,['Books and Literature'],1141
Why Can’t I Stop Watching This Cute Video About Animal Motherhood?,2022-09-14,article,News,Magazine,"['Parenting', 'Children and Childhood', 'Social Media']",1223
How to Make the Best Miso Soup of Your Life,2022-09-14,article,News,Magazine,"['Soups', 'Cooking and Cookbooks', 'Recipes', 'Japanese Food (Cuisine)']",902
After Dobbs: Does ‘Big Tent’ Feminism Exist? Should It?,2022-09-14,article,Op-Ed,Opinion,"[""Women's Rights"", 'audio-neutral-informative']",334
A 10-Year-Old Refugee Has Met a Million People. How Will New York Welcome Her?,2022-09-14,article,Op-Ed,Opinion,"['Refugees and Displaced Persons', 'Immigration and Emigration', 'Children and Childhood', 'Puppets']",665
Why Aren’t You Voting in Your Financial Self-Interest?,2022-09-14,article,Op-Ed,Opinion,"['United States Economy', 'Income Inequality', 'Conservatism (US Politics)', 'Sociology', 'United States Politics and Government']",2812
How Yiyun Li Became a Beacon for Readers in Mourning,2022-09-14,article,News,Magazine,"['Books and Literature', 'Writing and Writers', 'Content Type: Personal Profile', 'Grief (Emotion)', 'Suicides and Suicide Attempts']",4233
‘Disaster Mode’: Emergency Rooms Across Canada Close Amid Crisis,2022-09-14,article,News,World,"['Hospitals', 'Emergency Medical Treatment', 'Health Insurance and Managed Care']",1333
"In New York City, Pandemic Job Losses Linger",2022-09-14,article,News,New York,"['Labor and Jobs', 'Unemployment', 'Youth', 'Coronavirus (2019-nCoV)', 'Coronavirus Reopenings', 'Economic Conditions and Trends']",1583
Read Your Way Through Helsinki,2022-09-14,article,News,Books,"['Books and Literature', 'Libraries and Librarians', 'Writing and Writers', 'Language and Languages']",1120
"Social Security’s Cost-of-Living Increase Will Be Largest in Four Decades, an Estimate Says",2022-09-14,article,News,Business Day,"['Social Security (US)', 'Medicare', 'Inflation (Economics)', 'Consumer Price Index', 'Aduhelm (Drug)']",550
Hermès Bags and Millions in Cash: The Fall of Malaysia’s Najib Razak,2022-09-14,article,News,World,"['Politics and Government', 'Prisons and Prisoners', 'Money Laundering', 'Corruption (Institutional)', 'Content Type: Personal Profile']",1343
Little Dresses for Big Nights,2022-09-14,article,News,Style,"['Fashion and Apparel', 'New York Fashion Week', 'Content Type: Personal Profile']",1198
Text Messaging Is Cool. But Where Are Its Boundaries?,2022-09-14,article,News,Technology,"['Mobile Applications', 'Text Messaging', 'Computers and the Internet', 'Instant Messaging', 'Privacy', 'Software', 'Smartphones', 'iPhone', 'Wireless Communications', 'iOS (Operating System)', 'Android (Operating System)']",1274
What Conflicted Americans Fear Most From an Abortion Ban,2022-09-14,article,Op-Ed,Opinion,"['Abortion', 'Euthanasia and Assisted Suicide', 'Pregnancy and Childbirth', 'Suicides and Suicide Attempts', 'Roe v Wade (Supreme Court Decision)', ""Women's Rights""]",1434
Durham Inquiry Appears to Wind Down as Grand Jury Expires,2022-09-14,article,News,U.S.,"['Special Prosecutors (Independent Counsel)', 'Russian Interference in 2016 US Elections and Ties to Trump Associates', 'United States Politics and Government']",1298
"A Uyghur Author and Translator Were Detained. Now, Their Novel Speaks For Them.",2022-09-14,article,News,Books,"['Books and Literature', 'Uighurs (Chinese Ethnic Group)', 'Writing and Writers', 'Minorities', 'Mental Health and Disorders', 'Muslims and Islam', 'Discrimination']",1452
The Essential Judy Blume,2022-09-14,article,Review,Books,"['Books and Literature', 'Children and Childhood', 'Teenagers and Adolescence', 'genre-books-childrens', 'genre-books-young-adult']",1956
Six Lyrics That Show Why ‘Hamilton’ Is Tough to Translate,2022-09-14,article,News,Theater,"['Theater', 'German Language', 'Rap and Hip-Hop', 'Translation and Interpreters', 'Language and Languages']",1414
Braving the Winds on a Greek Isle,2022-09-14,article,News,Travel,"['Wind', 'Travel and Vacations']",1931
Gravel Biking Is Picking Up Speed,2022-09-14,article,News,Well,"['Bicycles and Bicycling', 'Cycling, Mountain Bike', 'Exercise', 'Cycling, Road']",1464
"Living In ... Dutch Kills, Queens",2022-09-14,multimedia,Slideshow,Real Estate,['Real Estate and Housing (Residential)'],0
The Mystery Behind the Crime Wave at 312 Riverside Drive,2022-09-14,article,News,New York,"['internal-sub-only', 'audio-neutral-suspenseful', 'Content Type: Personal Profile', 'Mental Health and Disorders', 'Nine-One-One (911) (Emergency Phone Number)', 'Affordable Housing']",3157
"Dutch Kills, Queens: Low-Key and Low-Slung, but Not for Much Longer",2022-09-14,article,News,Real Estate,['Real Estate and Housing (Residential)'],1532
How Nonbinary Runners are Winning Inclusion in Major Marathons,2022-09-14,article,News,Sports,"['Boston Marathon', 'Marathon Running', 'Transgender and Transsexuals', 'London Marathon', 'Chicago Marathon', 'Berlin Marathon']",916
They Translated ‘Hamilton’ Into German. Was It Easy? Nein.,2022-09-14,article,News,Theater,"['German Language', 'Translation and Interpreters', 'Theater', 'Rap and Hip-Hop', 'Music', 'audio-neutral-informative', 'audio-neutral-immersive']",2877
"Where the New Climate Law Means More Drilling, Not Less",2022-09-14,article,News,Climate,"['Oil (Petroleum) and Gasoline', 'Natural Gas', 'Drilling and Boring', 'Global Warming', 'Greenhouse Gas Emissions', 'Inflation Reduction Act of 2022', 'Oil Spills', 'Shrimp', 'Fishing, Commercial', 'Alternative and Renewable Energy', 'Hurricanes and Tropical Storms', 'United States Economy', 'United States Politics and Government']",1851
How a Spreader of Voter Fraud Conspiracy Theories Became a Star,2022-09-14,article,News,Technology,"['Voter Fraud (Election Fraud)', 'Presidential Election of 2020', 'Midterm Elections (2022)', 'Voting Rights, Registration and Requirements', 'Right-Wing Extremism and Alt-Right', 'Social Media', 'Project Democracy', 'Voting Machines', 'Rumors and Misinformation', 'Tea Party Movement', 'Conspiracy Theories', 'Content Type: Personal Profile']",1719
Ben Sinclair Gets Spiritual,2022-09-14,article,News,Style,"['Content Type: Personal Profile', 'Actors and Actresses', 'Religion and Belief']",991
An Old Finca With New Life on Ibiza,2022-09-14,multimedia,Slideshow,Real Estate,['Real Estate and Housing (Residential)'],0
House Hunting in Spain: An Updated Finca With Guesthouse on Ibiza,2022-09-14,article,News,Real Estate,['Real Estate and Housing (Residential)'],1131
What It Took for Stella Levi to Talk About the Holocaust,2022-09-14,article,Op-Ed,Opinion,"['Holocaust and the Nazi Era', 'Jews and Judaism', 'World War II (1939-45)', 'Content Type: Personal Profile']",1155
Was Elizabeth the Queen of America? This Week It Seemed Like It.,2022-09-14,article,News,U.S.,"['Royal Families', 'Revolutionary War, American (1775-83)', 'Colonization']",1122
Biden will be there; Putin won’t: The funeral guest list is coming together.,2022-09-14,article,News,World,['Funerals and Memorials'],333
"Irene Papas, Actress in ‘Zorba,’ ‘Z’ and Greek Tragedies, Is Dead at 96",2022-09-14,article,Obituary (Obit),Movies,"['Actors and Actresses', 'Deaths (Obituaries)']",931
The College Pricing Game,2022-09-14,article,News,Podcasts,"['Colleges and Universities', 'Student Loans', 'audio-neutral-informative']",330
E.U. Scores Major Legal Victory Against Google,2022-09-14,article,News,Business Day,"['Antitrust Laws and Competition Issues', 'Fines (Penalties)', 'Decisions and Verdicts', 'Computers and the Internet', 'Search Engines', 'Android (Operating System)']",413
"Poverty, Plunging",2022-09-14,article,briefing,Briefing,"['internal-storyline-no', 'Children and Childhood', 'United States Economy', 'Tax Credits, Deductions and Exemptions', 'Poverty', 'Prices (Fares, Fees and Rates)']",1719
A Danish royal who mourns her friend ‘Lilibet’ is now the reigning queen in Europe.,2022-09-14,article,News,World,"['Royal Families', 'International Relations']",672
Plum Finds Her Way as Aces Move One Win From W.N.B.A. Title,2022-09-14,article,News,Sports,['Basketball'],856
Why Are We Obsessed With Jiggling Foods?,2022-09-14,article,News,T Magazine,"['Gelatin', 'Food', 'Cheesecake', 'Food Contamination and Poisoning', 'Pudding']",2348
Europe Plans to Ban Goods Made With Forced Labor,2022-09-14,article,News,World,"['Politics and Government', 'Forced Labor', 'International Trade and World Market', 'Human Rights and Human Rights Violations']",827
The E.U.’s top official lays out plans for lasting support of Ukraine.,2022-09-14,article,News,World,['Russian Invasion of Ukraine (2022)'],468
Decoding the Surprise Inflation Report,2022-09-14,article,News,Business Day,['Inflation (Economics)'],1844
The queen’s coffin will leave Buckingham Palace at exactly 2:22 p.m.,2022-09-14,article,News,World,"['Royal Families', 'Funerals and Memorials']",241
"Bolduc Wins New Hampshire Senate Primary, Realizing G.O.P. Fears",2022-09-14,article,News,U.S.,"['United States Politics and Government', 'Politics and Government', 'Primaries and Caucuses', 'Midterm Elections (2022)', 'Elections, Senate']",1202
U.S. to Move Forward on Military Aid to Egypt Despite Lawmakers’ Concerns,2022-09-14,article,News,U.S.,"['Foreign Aid', 'Human Rights and Human Rights Violations', 'Political Prisoners', 'International Relations']",982
Where the ‘Rust Belt’ Meets the Runway,2022-09-14,article,News,Style,"['Fashion and Apparel', 'New York Fashion Week', 'Handbags and Purses']",314
Los Angeles to Memorialize 1871 Massacre of Chinese Residents,2022-09-14,article,briefing,U.S.,[],1424
Why Won’t My Husband Change His Will to Protect Our Baby and Me?,2022-09-14,article,News,Style,"['Customs, Etiquette and Manners', 'Content Type: Service', 'internal-sub-only']",871
Classic Tailoring Gets a New Twist,2022-09-14,article,News,T Magazine,"['Fashion and Apparel', 'Suits (Apparel)']",78
"A New Look at a Diane Arbus Exhibition, 50 Years Later",2022-09-14,article,News,T Magazine,['Photography'],989
Where’s the Next Party?,2022-09-14,article,News,Style,"['New York Fashion Week', 'Parties (Social)', 'Fashion and Apparel']",245
"Ostracized by the West, Russia Finds a Partner in Saudi Arabia",2022-09-14,article,News,Business Day,"['War and Armed Conflicts', 'Politics and Government', 'United States International Relations', 'Prices (Fares, Fees and Rates)', 'Oil (Petroleum) and Gasoline', 'Embargoes and Sanctions', 'International Trade and World Market', 'International Relations', 'Economic Conditions and Trends', 'Natural Gas', 'Russian Invasion of Ukraine (2022)']",1483
Alan Cumming Uses Dance to Get at the Truth of Robert Burns,2022-09-14,article,News,Arts,"['Dancing', 'Theater', 'Poetry and Poets', 'Content Type: Personal Profile', 'Edinburgh International Festival']",1523
Top European Court Condemns France Over Refusal to Bring Home ISIS Families,2022-09-14,article,News,World,"['Terrorism', 'Decisions and Verdicts', 'Human Rights and Human Rights Violations']",869
Retreat in Ukraine’s Northeast Leaves Other Russian Territory Vulnerable,2022-09-14,article,News,World,"['Russian Invasion of Ukraine (2022)', 'Defense and Military Forces']",426
Recipes to Make on Autopilot,2022-09-14,article,Letter,Food,"['Cooking and Cookbooks', 'Content Type: Service']",574
What School Anxiety Dreams Teach Us About Ourselves,2022-09-14,article,Op-Ed,Opinion,"['Anxiety and Stress', 'Dreams', 'Education (K-12)', 'Therapy and Rehabilitation', 'Tests and Examinations', 'Colleges and Universities', 'internal-sub-only-nl', 'Parenting']",1301
‘Do Revenge’: Paying Homage to Teen Classics by Way of Hitchcock,2022-09-14,article,News,Movies,"['Movies', 'Nineteen Hundred Nineties']",1349
Florentina Holzinger Makes Everyone Uncomfortable,2022-09-14,article,News,Arts,"['Content Type: Personal Profile', 'Dancing', 'Stunts and Stuntmen']",1238
"Robert Burns, Right-Wing Republican, Wins House Primary in New Hampshire",2022-09-14,article,News,U.S.,"['Primaries and Caucuses', 'Right-Wing Extremism and Alt-Right', 'Elections, House of Representatives', 'Midterm Elections (2022)']",486
U.S. Establishes Trust With $3.5 Billion in Frozen Afghan Central Bank Funds,2022-09-14,article,News,U.S.,"['Banking and Financial Institutions', 'Terrorism', 'September 11 (2001)', 'United States International Relations', 'United States Politics and Government']",905
Clothes That Meet the Moment,2022-09-14,article,News,Style,"['Fashion and Apparel', 'New York Fashion Week', 'your-feed-fashion']",835
"In Pakistan’s Record Floods, Villages Are Now Desperate Islands",2022-09-14,article,News,World,"['Floods', 'Monsoons', 'Deaths (Fatalities)', 'Global Warming', 'Evacuations and Evacuees']",1469
Charlotte Bennett Sues Cuomo Over Sexual Harassment Accusations,2022-09-14,article,News,New York,"['Sexual Harassment', 'Discrimination']",823
"Rommy Hunt Revson, Creator of the Scrunchie, Dies at 78",2022-09-14,article,Obituary (Obit),Style,"['Deaths (Obituaries)', 'Hair', 'Inventions and Patents']",917
"46 Years After His Death, the Producer Charles Stepney Shines Again",2022-09-14,article,News,Arts,"['Music', 'Content Type: Personal Profile']",1013
Don’t Be Shy: The Benefits of Talking to Strangers,2022-09-14,article,Letter,Opinion,"['Friendship', 'Shyness', 'Social Conditions and Trends', 'Russian Invasion of Ukraine (2022)', 'Murders, Attempted Murders and Homicides', 'Freedom of the Press']",1458
The queen’s funeral will be paid for by British taxpayers.,2022-09-14,article,News,World,"['Funerals and Memorials', 'Prices (Fares, Fees and Rates)', 'Royal Families', 'Inheritance and Estate Taxes']",471
"Little Amal Arrives in New York, With a Message of Hope and Humanity",2022-09-14,article,News,Theater,"['Puppets', 'Refugees and Displaced Persons', 'Theater', 'Middle East and Africa Migrant Crisis']",1618
E.U. Calls for Taxes to Battle Rising Energy Prices,2022-09-14,article,News,World,"['Russian Invasion of Ukraine (2022)', 'Electric Light and Power', 'Prices (Fares, Fees and Rates)', 'Energy and Power']",616
Christie’s and a Baltimore Gallery to Sell Work by Black Artists,2022-09-14,article,News,Arts,"['Auctions', 'Art', 'Black People', 'Blacks']",215
The Perseverance of Megan Thee Stallion,2022-09-14,article,News,Arts,"['Rap and Hip-Hop', 'audio-neutral-informative']",221
A New Ariel Inspires Joy for Young Black Girls: ‘She Looks Like Me’,2022-09-14,article,News,Arts,"['Movies', 'Black People', 'Blacks', 'Social Media']",1146
"Lily Renée Phillips, Pioneering Comic Book Artist, Dies at 101",2022-09-14,article,Obituary (Obit),Arts,"['Deaths (Obituaries)', 'Comic Books and Strips', 'Cartoons and Cartoonists', 'Art', 'Holocaust and the Nazi Era', 'Nineteen Hundred Forties', 'Women and Girls']",1322
France Will Cap Energy Price Hikes at 15 Percent,2022-09-14,article,News,World,"['Electric Light and Power', 'Prices (Fares, Fees and Rates)', 'Russian Invasion of Ukraine (2022)']",433
What’s in our Queue? ‘Everything’s Trash’ and More,2022-09-14,multimedia,Interactive Feature,Arts,[],0
California Files Antitrust Lawsuit Against Amazon,2022-09-14,article,News,Technology,"['Antitrust Laws and Competition Issues', 'E-Commerce', 'Computers and the Internet', 'Suits and Litigation (Civil)', 'Prices (Fares, Fees and Rates)']",1175
God Loves a Show: Religious Satires Reveal the Art of Acting Faithful,2022-09-14,article,News,Movies,"['Movies', 'Theater', 'Television', 'Religion and Belief']",1277
Have You Recently Purchased Your First Gun?,2022-09-14,article,News,U.S.,['internal-open-access'],105
Jokes + Exasperation + Subtext = a New York Club Comic on the Rise,2022-09-14,article,News,Arts,['Comedy and Humor'],996
Top E.U. Official Is Becoming an Unexpected Wartime Leader,2022-09-14,article,News,World,"['War and Armed Conflicts', 'Politics and Government', 'Russian Invasion of Ukraine (2022)', 'State of the Union Message (US)']",1259
China Is Writing the Story of the Climate Future,2022-09-14,article,Op-Ed,Opinion,"['internal-sub-only-nl', 'Heat and Heat Waves', 'Greenhouse Gas Emissions', 'Alternative and Renewable Energy', 'Weather', 'Carbon Dioxide', 'Drought']",1793
"In Dramatic Shift, Right-Wing Bloc Wins Slim Majority in Sweden",2022-09-14,article,News,World,"['Elections', 'Politics and Government', 'Right-Wing Extremism and Alt-Right']",1273
Two Nursing Home Residents Die After a Legionnaires’ Outbreak,2022-09-14,article,News,New York,"[""Legionnaires' Disease"", 'Deaths (Fatalities)', 'Nursing Homes', 'Hygiene and Cleanliness']",605
"Fearing flooding, Ukrainian officials call for evacuations after Russia damaged a dam.",2022-09-14,article,News,World,['Russian Invasion of Ukraine (2022)'],403
"Queen’s Coffin Passes London Landmarks, in a Grand but Hushed Royal Display",2022-09-14,article,News,World,"['Royal Families', 'Funerals and Memorials']",1200
"Oil Executives Privately Contradicted Public Statements on Climate, Files Show",2022-09-14,article,News,Climate,"['Global Warming', 'Greenhouse Gas Emissions', 'Oil (Petroleum) and Gasoline', 'United States Politics and Government', 'Rumors and Misinformation', 'Advertising and Marketing']",1212
Lindsey Graham’s Unbelievably Cruel Abortion Ban,2022-09-14,article,Op-Ed,Opinion,"['Abortion', 'United States Politics and Government', 'Midterm Elections (2022)']",1025
Billionaire No More: Patagonia Founder Gives Away the Company,2022-09-14,article,News,Climate,"['Global Warming', 'Philanthropy', 'Corporate Social Responsibility', 'High Net Worth Individuals', 'Capitalism (Theory and Philosophy)', 'Content Type: Personal Profile', 'Fashion and Apparel', 'Mergers, Acquisitions and Divestitures']",1752
"Former Car Dealership Workers Pocketed Customers’ Money, Sheriff’s Office Says",2022-09-14,article,News,U.S.,"['Automobiles', 'Embezzlement', 'Robberies and Thefts', 'Frauds and Swindling']",365
Mother Charged With Murdering 3 Children Who Drowned in Coney Island,2022-09-14,article,News,New York,"['Murders, Attempted Murders and Homicides']",679
How a Rail Strike Could Wreak Havoc on the American Supply Chain,2022-09-14,article,News,Business Day,"['Railroads', 'Strikes', 'Organized Labor', 'Supply Chain', 'Freight (Cargo)', 'United States Economy', 'International Trade and World Market', 'Agriculture and Farming', 'Trucks and Trucking', 'Ships and Shipping']",1606
"Melvin Sokolsky, Surrealist Fashion Photographer, Dies at 88",2022-09-14,article,Obituary (Obit),Fashion & Style,"['Deaths (Obituaries)', 'Fashion and Apparel', 'Photography']",1227
Sweden’s Far Right Just Made History. Is It the Country’s Future?,2022-09-14,article,News,World,"['Elections', 'Right-Wing Extremism and Alt-Right', 'Fringe Groups and Movements', 'Immigration and Emigration', 'European Sovereign Debt Crisis (2010- )', 'Polls and Public Opinion', 'Politics and Government']",1186
N.B.A. Commissioner Defends Sarver’s One-Year Suspension for Misconduct,2022-09-14,article,News,Sports,"['Basketball', 'Discrimination', 'Indecency, Obscenity and Profanity', 'Ethics and Official Misconduct']",1175
An Eastern City Under Attack Wonders How Far Ukraine’s Offensive Can Go,2022-09-14,article,News,World,"['Russian Invasion of Ukraine (2022)', 'War and Armed Conflicts']",1010
"Your Thursday Briefing: Pakistan, Submerged",2022-09-14,article,briefing,Briefing,"['Politics and Government', 'Russian Invasion of Ukraine (2022)', 'Floods', 'Content Type: Personal Profile', 'Movies']",1243
U.S. Charges 3 Iranians in Broad Hacking Scheme,2022-09-14,article,News,U.S.,"['Cyberwarfare and Defense', 'Computers and the Internet', 'Cyberattacks and Hackers', 'Extortion and Blackmail']",725
‘Terra Femme’ Review: How Women Have Seen the World,2022-09-14,article,Review,Movies,"['Women and Girls', 'Documentary Films and Programs', 'Nineteen Hundred Twenties', 'Nineteen Hundred Thirties']",320
"President Biden will nominate Lynne M. Tracy, a career diplomat, to be ambassador to Russia.",2022-09-14,article,News,World,[],262
A jury in Chicago has reached a verdict in the R. Kelly trial.,2022-09-14,article,News,Arts,[],358
Amtrak Halts Long-Distance Service Over Freight Rail Labor Dispute,2022-09-14,article,News,Business Day,"['Railroads', 'Freight (Cargo)', 'Strikes', 'Lockouts', 'Organized Labor', 'Travel and Vacations']",333
"Two 25-Year-Olds Could Be Elected to Congress, a Historical Rarity",2022-09-14,article,News,U.S.,"['Generation Z', 'Elections, House of Representatives']",496
Prosecutors Move to Overturn Murder Conviction in ‘Serial’ Case,2022-09-14,article,News,U.S.,"['False Arrests, Convictions and Imprisonments', 'Murders, Attempted Murders and Homicides']",1092
"War May Be Distant in Moscow, but in One Russian Border City, It’s Real",2022-09-14,article,News,World,"['Russian Invasion of Ukraine (2022)', 'Defense and Military Forces']",1395
"Suddenly, Putin in a Bind",2022-09-14,article,News,Briefing,"['Russian Invasion of Ukraine (2022)', 'Politics and Government', 'Defense and Military Forces']",1162
"To Deal With Film Festival Pressure, Sarah Polley Heads for the Hills",2022-09-14,article,News,Movies,"['Movies', 'Telluride Film Festival', 'Toronto International Film Festival']",641
Thanking Those Who Got Us Through It,2022-09-14,article,News,Briefing,"['Quarantine (Life and Culture)', 'Coronavirus (2019-nCoV)', 'Friendship']",1742
A Sports Media Empire Runs on ‘Good Vibes Only’,2022-09-14,article,News,Sports,"['Baseball', 'Social Media', 'Content Type: Personal Profile']",1473
Biden Maneuvers to Try to Avoid Devastating Rail Strike,2022-09-14,article,News,U.S.,"['Railroads', 'Strikes', 'Organized Labor', 'Supply Chain', 'Freight (Cargo)', 'United States Politics and Government', 'United States Economy', 'Inflation (Economics)']",1615
"Art Rosenbaum, Painter and Preserver of Folk Music, Dies at 83",2022-09-14,article,Obituary (Obit),U.S.,"['Pop and Rock Music', 'Music', 'Art', 'Deaths (Obituaries)', 'Culture (Arts)', 'Folk Music']",1211
Your Wednesday Evening Briefing,2022-09-14,article,briefing,Briefing,[],1279
"At Detroit Auto Show, Biden Announces Money for Charging Stations",2022-09-14,article,News,U.S.,"['Automobiles', 'Electric and Hybrid Vehicles', 'North American International Auto Show', 'Tax Credits, Deductions and Exemptions', 'Infrastructure Investment and Jobs Act (2021)']",1044
The State Department warned private citizens not to negotiate prisoner swaps with Russia.,2022-09-14,article,News,World,[],315
"Trump’s ‘Muddled’ Claims About the Presidential Records Act, Explained",2022-09-14,article,News,U.S.,"['Classified Information and State Secrets', 'Archives and Records', 'Search and Seizure', 'United States Politics and Government', 'Law and Legislation']",1658
U.S. Population Growth Has Nearly Flatlined. Is That So Bad?,2022-09-14,article,Op-Ed,Opinion,"['Population', 'Birth Rates', 'Economic Conditions and Trends']",1554
The Misconduct of Powerful Men in Sports Is a Tired Replay,2022-09-14,article,News,Sports,"['Basketball', 'Discrimination', 'Women and Girls', 'Race and Ethnicity', 'Workplace Hazards and Violations']",876
Lawmakers Grill TikTok Executive About Ties to China,2022-09-14,article,News,Technology,"['Social Media', 'Mobile Applications', 'Computers and the Internet', 'Regulation and Deregulation of Industry', 'Computer Security', 'United States Politics and Government', 'United States International Relations', 'Politics and Government']",790
Supreme Court Says Yeshiva University Must Allow L.G.B.T. Group as Case Proceeds,2022-09-14,article,News,U.S.,"['Colleges and Universities', 'Religion-State Relations', 'Freedom of Religion', 'Orthodox Judaism', 'Discrimination', 'Homosexuality and Bisexuality', 'Transgender and Transsexuals', 'Organizations, Societies and Clubs', 'Decisions and Verdicts', 'Suits and Litigation (Civil)']",897
